{
  "$schema": "https://json-schema.org/draft/2020-12/schema",
  "type": "object",
  "additionalProperties": true,
  "title": "ColorPrepressReport",
  "required": [
    "document_id",
    "output_intents",
    "colour_findings",
    "font_findings"
  ],
  "properties": {
    "document_id": {
      "type": "string"
    },
    "output_intents": {
      "type": "array"
    },
    "colour_findings": {
      "type": "array"
    },
    "font_findings": {
      "type": "array"
    },
    "page_box_findings": {
      "type": "array"
    }
  }
}